ID,Name,Description,Contributor,Citation,Examples_Count
278,Interpreting language-learning data,,"Edmonds, Amanda and Leclercq, Pascale and Gudmestad, Aarnes"," Edmonds, Amanda and Leclercq, Pascale and Gudmestad, Aarnes (eds.) 2020. Interpreting language-learning data. (EuroSLA Studies.) Berlin: Language Science Press.",64
279,Forthcoming: Language contact: Bridging the gap between individual interactions and areal patterns,,"van Gijn, Rik and Ruch, Hanna and Wahlström, Max and Hasse, Anja"," van Gijn, Rik and Ruch, Hanna and Wahlström, Max and Hasse, Anja (eds.) Forthcoming. Forthcoming: Forthcoming: Language contact. (Language Variation.) Berlin: Language Science Press.",3
280,Advances in formal Slavic linguistics 2018,,"Blümel, Andreas and Gajić, Jovana and Geist, Ljudmila and Junghanns, Uwe and Pitsch, Hagen"," Blümel, Andreas and Gajić, Jovana and Geist, Ljudmila and Junghanns, Uwe and Pitsch, Hagen (eds.) 2021. Advances in formal Slavic linguistics 2018. (Open Slavic Linguistics.) Berlin: Language Science Press.",595
282,Demonstratives in discourse,,"Næss, Åshild and Margetts, Anna and Treis, Yvonne"," Næss, Åshild and Margetts, Anna and Treis, Yvonne (eds.) 2020. Demonstratives in discourse. (Topics at the Grammar-Discourse Interface.) Berlin: Language Science Press.",414
283,"Nominal anchoring: Specificity, definiteness and article systems across languages",,"Balogh, Kata and Latrouite, Anja and Van Valin, Robert D."," Balogh, Kata and Latrouite, Anja and Van Valin, Robert D. (eds.) 2020. Nominal anchoring. (Topics at the Grammar-Discourse Interface.) Berlin: Language Science Press.",286
288,"Translation, interpreting, cognition: The way out of the box",,"Tra   Co Group,"," Tra   Co Group, (ed.) 2021. Translation, interpreting, cognition. (Translation and Multilingual Natural Language Processing.) Berlin: Language Science Press.",1
289,Explaining Russian-German code-mixing: A usage-based approach,,"Hakimov, Nikolay","Hakimov, Nikolay. 2021. Explaining Russian German code-mixing. (Contact and Multilingualism.) Berlin: Language Science Press.",125
293,Celebrating 50 years of ACAL: Selected papers from the 50th Annual Conference on African Linguistics,,"Akinlabi, Akinbiyi and Bickmore, Lee and Cahill, Michael and Diercks, Michael and Downing, Laura J and Essegbey, James and Franich, Katie and McPherson, Laura"," Akinlabi, Akinbiyi and Bickmore, Lee and Cahill, Michael and Diercks, Michael and Downing, Laura J and Essegbey, James and Franich, Katie and McPherson, Laura (eds.) 2021. Celebrating 50 years of ACAL. (Contemporary African Linguistics.) Berlin: Language Science Press.",409
295,A grammar of Japhug,,"Jacques, Guillaume","Jacques, Guillaume. 2021. A grammar of Japhug. (Comprehensive Grammar Library.) Berlin: Language Science Press.",3525
296,Empirical studies in translation and discourse,,"Bisiada, Mario"," Bisiada, Mario (ed.) 2021. Empirical studies in translation and discourse. (Translation and Multilingual Natural Language Processing.) Berlin: Language Science Press.",1
298,A grammar of Gyeli,,"Grimm, Nadine","Grimm, Nadine. 2021. A grammar of Gyeli. (Comprehensive Grammar Library.) Berlin: Language Science Press.",1345
299,OV and VO variation in code-switching,,"Shim, Ji Young","Shim, Ji Young. 2021. OV and VO variation in code-switching. (Current Issues in Bilingualism.) Berlin: Language Science Press.",51
304,Formulaic language: Theories and methods,,"Trklja, Aleksandar and Grabowski, Łukasz"," Trklja, Aleksandar and Grabowski, Łukasz (eds.) 2021. Formulaic language. (Phraseology and Multiword Expressions.) Berlin: Language Science Press.",32
305,German(ic) in language contact: Grammatical and sociolinguistic dynamics,,"Zimmer, Christian"," Zimmer, Christian (ed.) 2021. German(ic) in language contact. (Language Variation.) Berlin: Language Science Press.",39
306,Descriptive and theoretical approaches to African linguistics: Selected papers from the 49th Annual Conference on African Linguistics,,"Sibanda, Galen and Ngonyani, Deo and Choti, Jonathan and Biersteker, Ann"," Sibanda, Galen and Ngonyani, Deo and Choti, Jonathan and Biersteker, Ann (eds.) Forthcoming. Forthcoming: Descriptive and theoretical approaches to African linguistics. (Contemporary African Linguistics.) Berlin: Language Science Press.",321
308,A grammar of Tuatschin: A Sursilvan Romansh dialect,,"Maurer-Cecchini, Philippe","Maurer-Cecchini, Philippe. 2021. A grammar of Tuatschin. (Comprehensive Grammar Library.) Berlin: Language Science Press.",1488
315,Voice syncretism,,"Bahrt, Nicklas N.","Bahrt, Nicklas N. 2021. Voice syncretism. (Research on Comparative Grammar.) Berlin: Language Science Press.",137
316,Formal approaches to number in Slavic and beyond,,"Dočekal, Mojmír and Wągiel, Marcin"," Dočekal, Mojmír and Wągiel, Marcin (eds.) 2021. Formal approaches to number in Slavic and beyond. (Open Slavic Linguistics.) Berlin: Language Science Press.",344
318,Paradigms regained: Theoretical and empirical arguments for the reassessment of the notion of paradigm,,"Diewald, Gabriele and Politt, Katja"," Diewald, Gabriele and Politt, Katja (eds.) 2022. Paradigms regained. (Empirically Oriented Theoretical Morphology and Syntax.) Berlin: Language Science Press.",170
321,Experimental investigations on the syntax and usage of fragments,,"Lemke, Robin","Lemke, Robin. 2021. Experimental investigations on the syntax and usage of fragments. (Open Germanic Linguistics.) Berlin: Language Science Press.",90
323,The size of things I: Structure building,,"Laszakovits, Sabine and Shen, Zheng"," Laszakovits, Sabine and Shen, Zheng (eds.) 2021. The size of things I. (Open Generative Syntax.) Berlin: Language Science Press.",512
326,A dictionary and grammatical sketch of Ruruuli-Lunyala,,"Namyalo, Saudah and Witzlack-Makarevich, Alena and Kiriggwajjo, Anatole and Atuhairwe, Amos and Molochieva, Zarina and Mukama, Ruth Gimbo  and Zellers, Margaret","Namyalo, Saudah and Witzlack-Makarevich, Alena and Kiriggwajjo, Anatole and Atuhairwe, Amos and Molochieva, Zarina and Mukama, Ruth Gimbo  and Zellers, Margaret. 2021. A dictionary and grammatical sketch of Ruruuli Lunyala. (African Language Grammars and Dictionaries.) Berlin: Language Science Press.",280
329,Morphosyntactic change in Late Modern Swedish,,"Larsson, Ida and Petzell, Erik M."," Larsson, Ida and Petzell, Erik M. (eds.) 2021. Morphosyntactic change in Late Modern Swedish. (Open Germanic Linguistics.) Berlin: Language Science Press.",442
339,"Clitics in the wild : Empirical studies on the microvariation of the pronominal, reflexive and verbal clitics in Bosnian, Croatian and Serbian.",,"Kolaković, Zrinka and Jurkiewicz-Rohrbacher, Edyta and Hansen, Björn and Filipović Đurđević, Dušica and Fritz, Nataša","Kolaković, Zrinka and Jurkiewicz-Rohrbacher, Edyta and Hansen, Björn and Filipović Đurđević, Dušica and Fritz, Nataša. 2022. Clitics in the wild. (Open Slavic Linguistics.) Berlin: Language Science Press.",489
